,position,title,link,text,bold,Author,Query
0,1,How Can I Lower My Blood Pressure in Minutes? - MedicineNet,https://www.medicinenet.com/how_can_i_lower_my_blood_pressure_in_minutes/article.htm,"Feb 9, 2022 — If your blood pressure is elevated and you want to see an immediate change, lie down and take deep breaths. This is how you lower your blood ...",your blood pressure,Aswin,cure high blood pressure in 3 mins
1,2,How to Lower Blood Pressure Immediately - Tufts Medical ...,https://hhma.org/how-can-i-lower-my-blood-pressure-immediately/,Take a warm bath or shower. Stay in your shower or bath for at least 15 minutes and enjoy the warm water. This can also help reduce muscle tension. · Do a ...,your,Aswin,cure high blood pressure in 3 mins
2,3,How to Lower Blood Pressure in Minutes - Canadian ...,https://www.canpharm.com/blog/high-to-low-blood-pressure-in-minutes,Here is how to cure high blood pressure in 3 minutes or less: · Take a deep breath from your belly · Hold your breath for about 2 seconds then release slowly ...,cure high blood pressure,Aswin,cure high blood pressure in 3 mins
3,4,10 ways to control high blood pressure without medication,https://www.mayoclinic.org/diseases-conditions/high-blood-pressure/in-depth/high-blood-pressure/art-20046974,You can lower your blood pressure without medication. Try these 10 lifestyle changes.,lower your blood pressure,Aswin,cure high blood pressure in 3 mins
4,5,How to lower blood pressure in MINUTES - YouTube,https://www.youtube.com/watch?v=1lwYseaL4m8,"Jun 14, 2017 — How to lower blood pressure in MINUTES naturally without pills. Use this one simple technique daily, every day, forever. This is the BEST ...",lower blood pressure,Aswin,cure high blood pressure in 3 mins
5,6,Lowering Blood Pressure in 5 Minutes - YouTube,https://www.youtube.com/watch?v=3KueabH8B8M,"Feb 24, 2019 — “High blood pressure is a major risk factor for cardiovascular ... “Having another option in the toolbox to help prevent it would be a real ...",high blood pressure,Aswin,cure high blood pressure in 3 mins
6,7,How To Lower High Blood Pressure Fast | 5 Quick Ways,https://www.youtube.com/watch?v=oLzIgqqWqS8,"Feb 22, 2019 — Chapters. View all · High blood pressure · Walk and exercise regularly · Reduce your sodium intake · Less alcohol.",high blood pressure,Aswin,cure high blood pressure in 3 mins
7,8,What's the Fastest Way to Lower My Blood Pressure Safely?,https://www.goodrx.com/conditions/hypertension/fastest-way-to-lower-blood-pressure-safely,"Feb 3, 2022 — Reduce the sodium in your diet. Too much sodium (or salt) causes blood pressure to rise. The AHA recommends keeping your daily sodium intake ...",reduce,Aswin,cure high blood pressure in 3 mins
8,9,How Can I Lower My Blood Pressure Immediately Naturally ...,https://www.onhealth.com/content/1/lower_blood_pressure_immediately_naturally_chart,"Aug 12, 2021 — Regular exercise strengthens your heart and helps prevent high blood pressure. Most healthy people need 150 minutes of moderate-intensity ...",your,Aswin,cure high blood pressure in 3 mins
9,10,How to lower blood pressure fast - Medical News Today,https://www.medicalnewstoday.com/articles/how-to-lower-blood-pressure-fast,"Apr 21, 2021 — Getting daily exercise: Increasing daily activity — for example, by spending more time walking and less time driving — is beneficial to health.",for,Aswin,cure high blood pressure in 3 mins
10,11,17 Effective Ways to Lower Your Blood Pressure - Healthline,https://www.healthline.com/health/high-blood-pressure-hypertension/lower-it-fast,"Fresh garlic or garlic extract are both widely used to lower blood pressure. A meta-analysis found that for people with high blood pressure, garlic supplements ...",lower blood pressure,Aswin,cure high blood pressure in 3 mins
11,12,15 natural ways to lower your blood pressure - Medical News ...,https://www.medicalnewstoday.com/articles/318716,3 days ago — Bottom line: Walking just 30 minutes a day can help lower your blood pressure. More exercise helps reduce it even further.,minutes,Aswin,cure high blood pressure in 3 mins
12,13,A simple trick to lower your blood pressure - Nuffield Health,https://www.nuffieldhealth.com/article/a-simple-trick-to-lower-your-blood-pressure,"Jan 30, 2017 — Set the spring resistance to 50% of maximum resistance. After doing this you should aim to squeeze the device as far as possible and hold that ...",,Aswin,cure high blood pressure in 3 mins
13,14,How to lower blood pressure quickly and naturally - SingleCare,https://www.singlecare.com/blog/ways-to-manage-high-blood-pressure-medication/,Exercise: Make regular physical activity part of your daily routine; even just a half hour per day can boost health and help you achieve a healthy weight.,your,Aswin,cure high blood pressure in 3 mins
14,15,Can you lower your blood pressure in 3 minutes? - Daily ...,https://www.express.co.uk/life-style/health/1507134/High-blood-pressure-lower-3-minutes-hypertension-evg,"Oct 17, 2021 — This should help lower your blood pressure within minutes as it will help to slow down your heart rate which should decrease your blood pressure ...",lower your blood pressure,Aswin,cure high blood pressure in 3 mins
15,16,4 Tips To Lower Blood Pressure Fast In Emergencies - Aditya ...,https://www.adityabirlacapital.com/healthinsurance/active-together/2020/06/24/lower-blood-pressure-in-emergency/,"Jun 24, 2020 — How to Lower Blood Pressure Instantly in an Emergency at Home? · Try to stay calm. · Take your blood pressure medication if your doctor has ...",lower blood pressure,Aswin,cure high blood pressure in 3 mins
16,17,"5-Minute Breathing Exercises Can Lower BP, Heart Attack Risk",https://www.webmd.com/hypertension-high-blood-pressure/news/20210708/breathing-exercises-lower-bp-heart-attack-risk,"What Does the Systolic Blood Pressure Number Mean? — July 8, 2021 -- The demands of daily life often hinder people from getting enough physical exercise.",blood pressure,Aswin,cure high blood pressure in 3 mins
17,18,How To Lower High Blood Pressure Naturally At Home - Forbes,https://www.forbes.com/health/healthy-aging/how-to-lower-blood-pressure/,"Oct 18, 2021 — Most doctors recommend at least 30 minutes of moderate-intensity aerobic exercise each day. “Aerobic exercise gets the heart rate up in a ...",minutes,Aswin,cure high blood pressure in 3 mins
18,19,What's the fastest way to lower blood pressure safely? - Drugs ...,https://www.drugs.com/medical-answers/fastest-lower-blood-pressure-safely-3563534/,"Nov 10, 2021 — Rest and lie down for 10 minutes · Take slow, deep breaths · De-stress · Drink more water · Maintain a normal weight · Eat a heart-healthy diet · Cut ...",for,Aswin,cure high blood pressure in 3 mins
19,20,How long does it take to lower blood pressure? | Ask the Experts,https://www.pritikin.com/how-long-lower-blood-pressure,What is the Pritikin Program for lowering blood pressure? · Providing at least 5 servings of vegetables and 4 servings of fruits daily · Cutting back on calorie- ...,for,Aswin,cure high blood pressure in 3 mins
20,21,One exercise to lower high blood pressure instantly - Times of ...,https://timesofindia.indiatimes.com/life-style/health-fitness/health-news/one-exercise-to-lower-high-blood-pressure-instantly/photostory/87290620.cms,"Oct 27, 2021 — Add ginger to your diet. Ginger is a superfood, loaded with nutrients. It improves blood circulation, controls blood pressure and relaxes the ...",your,Aswin,cure high blood pressure in 3 mins
21,22,How to Prevent High Blood Pressure - MedlinePlus,https://medlineplus.gov/howtopreventhighbloodpressure.html,"Feb 28, 2017 — Getting regular exercise. Exercise can help you maintain a healthy weight and lower your blood pressure. You should try to get moderate- ...",lower your blood pressure,Aswin,cure high blood pressure in 3 mins
22,23,Evidence for exercise training in the management of ... - NCBI,https://www.ncbi.nlm.nih.gov/pmc/articles/PMC4369613/,"by AS Ghadieh · 2015 · Cited by 117 — Moderate intensity aerobic exercise has been proven to prevent hypertension and to help in the management of stage 1 hypertension. Dynamic resistance exercises, ...",prevent hypertension,Aswin,cure high blood pressure in 3 mins
23,24,Wait A Few Minutes: Blood Pressure Readings Lower When ...,https://www.sciencedaily.com/releases/2006/04/060420232237.htm,"Apr 20, 2006 — Nov. 22, 2017 — A study of more than 400 adults with prehypertension, or stage 1 high blood pressure, found that combining a low-salt diet ...",high blood pressure,Aswin,cure high blood pressure in 3 mins
24,25,The 6 best exercises to control high blood pressure,https://www.honorhealth.com/healthy-living/6-best-exercises-control-high-blood-pressure,1. Ten minutes of brisk or moderate walking three times a day. Exercise lowers blood pressure by reducing blood vessel stiffness so blood can flow more easily.,minutes,Aswin,cure high blood pressure in 3 mins
25,26,How much exercise is required to reduce blood pressure in ...,https://academic.oup.com/ajh/article/16/8/629/199247,"by K Ishikawa-Takata · 2003 · Cited by 246 — Regular aerobic exercise is widely recommended for essential hypertensives. However, it is not clear how much exercise is needed to reduce blood pressure ...",for,Aswin,cure high blood pressure in 3 mins
26,27,Best way to Cure High Blood Pressure in 3 Minutes,https://webnews21.com/best-way-to-cure-high-blood-pressure-in-3-minutes/,5 days ago — One of the best ways to treat hypertension is to engage in regular aerobic exercises. Aerobic exercises can help you burn calories and reduce ...,treat hypertension,Aswin,cure high blood pressure in 3 mins
27,28,Research Story Tip: Study Says Blood Pressure Readings ...,https://www.hopkinsmedicine.org/news/newsroom/news-releases/research-story-tip-study-says-blood-pressure-readings-accurate-with-less-than-three-minutes-rest,"Sep 15, 2020 — ... Blood Pressure Readings Accurate with Less Than a Three-Minute Rest ... Hopkins Medicine researchers shows that taking blood pressures ...",blood pressure,Aswin,cure high blood pressure in 3 mins
28,29,How to get blood pressure down to 120 | CNN,https://www.cnn.com/2015/09/18/health/how-to-lower-blood-pressure-tips/index.html,"Sep 18, 2015 — The DASH diet is high in fruits, vegetables and fiber, and low in sodium. It may further reduce systolic blood pressure by about 3 points ...",high,Aswin,cure high blood pressure in 3 mins
29,30,How Long Does It Take to Lower Blood Pressure? - Verywell ...,https://www.verywellhealth.com/how-long-does-it-take-to-lower-blood-pressure-5204833,"Oct 23, 2021 — If you have severe symptoms from high blood pressure, your doctor will probably have you admitted to the hospital, where you can receive ...",high blood pressure,Aswin,cure high blood pressure in 3 mins
30,31,5 Natural Ways to Lower Blood Pressure - Penn Medicine,https://www.pennmedicine.org/updates/blogs/health-and-wellness/2020/january/lower-blood-pressure-naturally,"Mar 22, 2022 — 1. Regular Physical Activity Helps Improve Health · 2. Eat Less Salt · 3. Add More Potassium to Your Diet to Reduce High Blood Pressure · 4. Limit ...",3,Aswin,cure high blood pressure in 3 mins
31,32,Blood Pressure: Treatments - Cleveland Clinic,https://my.clevelandclinic.org/health/diseases/17649-blood-pressure,"Jun 10, 2019 — Do not smoke or drink caffeine 30 minutes before you measure your blood pressure. If you are nervous when you go to the doctor, you could have a ...",minutes,Aswin,cure high blood pressure in 3 mins
32,33,Hypertension (High Blood Pressure) (for Teens) - Kids Health,https://kidshealth.org/en/teens/hypertension.html,Avoid alcohol. Get regular exercise: Try to exercise for 30–60 minutes at least 3–5 times a week. Teens with severe hypertension should ...,avoid,Aswin,cure high blood pressure in 3 mins
33,34,"Morning exercise, short breaks from sitting lower high blood ...",https://www.reuters.com/article/us-health-hypertension-fitness/morning-exercise-short-breaks-from-sitting-lower-high-blood-pressure-idUSKCN1QB21R,"Feb 22, 2019 — (Reuters Health) - Combining 30 minutes of morning exercise with short walking breaks throughout the day may help control blood pressure, ...",minutes,Aswin,cure high blood pressure in 3 mins
34,35,High blood pressure - Heart and Stroke Foundation of Canada,https://www.heartandstroke.ca/heart-disease/risk-and-prevention/condition-risk-factors/high-blood-pressure,"Eat a healthy, balanced diet that is lower in salt and fat (especially saturated fat). Get tips on healthy eating and learn more about the DASH eating plan, ...",lower,Aswin,cure high blood pressure in 3 mins
35,36,The 6 best exercises to control high blood pressure,https://www.honorhealth.com/healthy-living/6-best-exercises-control-high-blood-pressure,1. Ten minutes of brisk or moderate walking three times a day. Exercise lowers blood pressure by reducing blood vessel stiffness so blood can flow more easily.,minutes,Aswin,cure high blood pressure in 3 mins
36,37,How much diet and exercise can lower your blood pressure,https://www.cspinet.org/daily/salt-in-food/how-much-diet-and-exercise-can-lower-your-blood-pressure,"May 29, 2019 — 1. Eat a DASH diet: 11 points · 2. Exercise: 5 points · 3. Lose weight: 5 points · 4. Cut salt: 5 points · 5. Get more potassium: 4 to 5 points · 6.",3,Aswin,cure high blood pressure in 3 mins
37,38,Waiting a few extra minutes before measuring blood pressure ...,https://www.nature.com/articles/jhh201338,"by SB Nikolic · 2014 · Cited by 40 — Abstract. Office blood pressure (BP) is recommended to be measured after 5 min of seated rest, but it may decrease for 10 min of seated ...",blood pressure,Aswin,cure high blood pressure in 3 mins
38,39,High Blood Pressure - Hypertension. Causes & Treatment,https://www.heartfoundation.org.nz/wellbeing/managing-risk/managing-high-blood-pressure,"Being more active is a great way to lower your blood pressure. Ideally you should do 30 minutes of activity a day. If you can't do it all in one go, it can be ...",lower your blood pressure,Aswin,cure high blood pressure in 3 mins
39,40,Prevention - High blood pressure (hypertension) - NHS,https://www.nhs.uk/conditions/high-blood-pressure-hypertension/prevention/,"Regular exercise can also help you lose weight, which will also help lower your blood pressure. Adults should do at least 150 minutes (2 hours and 30 ...",lower your blood pressure,Aswin,cure high blood pressure in 3 mins
40,41,Does Exercise Lower Your Blood Pressure? - Bicycling ...,https://www.bicycling.com/health-nutrition/a25683209/does-exercise-lower-blood-pressure/,"Apr 10, 2021 — Those who racked up about 28 minutes of short-bout activity on a daily basis were 31 percent less likely to develop high blood pressure than ...",minutes,Aswin,cure high blood pressure in 3 mins
41,42,10 Reasons Your Blood Pressure Fluctuates - Omron ...,https://omronhealthcare.com/blog/10-reasons-your-blood-pressure-fluctuates-the-answers-will-shock-you/,"Apr 23, 2019 — Take it easy before taking your BP. Rest for at least five minutes before your first measurement. Don't smoke, drink caffeinated beverages or ...",your,Aswin,cure high blood pressure in 3 mins
42,43,17 Expert Tips to Lower Blood Pressure Naturally Without Drugs,https://www.prevention.com/health/health-conditions/a20428370/how-to-lower-blood-pressure-naturally/,"Jan 3, 2022 — How is high blood pressure treated? · 1. Get more exercise. · 2. Let yourself relax. · 3. Cut down on salt. · 4. Pick potassium-rich foods. · 5.",high blood pressure,Aswin,cure high blood pressure in 3 mins
43,44,High Blood Pressure Symptoms and Causes | cdc.gov,https://www.cdc.gov/bloodpressure/about.htm,"What can I do to prevent or manage high blood pressure? · Getting at least 150 minutes of physical activity each week (about 30 minutes a day, 5 days a week) ...",prevent,Aswin,cure high blood pressure in 3 mins
44,45,13 Natural Ways To Lower Your Blood Pressure - ABC News,https://abcnews.go.com/Health/Wellness/13-natural-ways-lower-blood-pressure/story?id=19251901,"May 24, 2013 — quicklist: 1category: Natural Ways To Lower Your Blood Pressuretitle: Go for Power Walksurl: text: Hypertensive patients who went for fitness ...",lower your,Aswin,cure high blood pressure in 3 mins
45,46,Blood pressure numbers & what they mean - HealthPartners,https://www.healthpartners.com/blog/which-numbers-mean-high-blood-pressure/,"What are the numbers for high blood pressure, what do they mean and how can you lower them? 6 min read. by HealthPartners. How good are you at numbers?",for high blood pressure,Aswin,cure high blood pressure in 3 mins
46,47,High blood pressure (hypertension) - Illnesses & conditions,https://www.nhsinform.scot/illnesses-and-conditions/heart-and-blood-vessels/conditions/high-blood-pressure-hypertension,"Oct 22, 2021 — eating a healthier diet; exercising more regularly; reducing the amount of alcohol that you drink. Medication that can help you lower your blood ...",reducing,Aswin,cure high blood pressure in 3 mins
47,48,How Can I Lower My Blood Pressure In Minutes - Glitsa,https://glitsa.com/fiihpressure/how-can-i-lower-my-blood-pressure-zosrj-in-minutes,"Mueller first realized that some scholars random methods of studying mutations, even experimental mutations, could never beta blockers for high blood pressure ...",for high blood pressure,Aswin,cure high blood pressure in 3 mins
48,49,How is High Blood Pressure Treated? - National Kidney ...,https://www.kidney.org/atoz/content/hbptreat,"There is no cure for high blood pressure. But treatment can lower blood pressure that is too high. If it is mild, high blood pressure may sometimes be ...",cure for high blood pressure,Aswin,cure high blood pressure in 3 mins
49,50,Blood Pressure and Your Brain - HelpGuide.org,https://www.helpguide.org/articles/healthy-living/blood-pressure-and-your-brain.htm,"30 minutes of moderate aerobic exercise, such as walking, for five days of the week can reduce your reading by 4 to 11 mm Hg. Step 2: Eat a heart-healthy diet.",minutes,Aswin,cure high blood pressure in 3 mins
